{"contract_version":"1.0.0","metric_name":"quality","editor_id":"editor-42","performance_label":"Meets Expectations","label_column_id":"performance_label","label_mapping_version":"quality-label-v1","revision_context":{"count":3},"evidence":{"source":"monday","monday_board_id":"board-1","monday_item_id":"item-1","column_ids":["performance_label"],"event_ids":["event-102"],"source_timestamps":["2026-09-01T11:10:00Z"],"source_values":{"performance_label":"Meets Expectations"},"rule_version":"quality-v1","calculated_at":"2026-09-01T11:12:00Z"}}
